{"run":245,"commit":"a7b8b46","metric":493,"metrics":{"api_tests":493,"frontend_tests":509,"ts_errors":0},"status":"keep","description":"Add faceRecognition API client tests: 404 status, network errors for recognize/register/getStatus","timestamp":1778118423612,"segment":0,"confidence":13.64}
{"run":246,"commit":"8b7c26e","metric":496,"metrics":{"api_tests":493,"frontend_tests":512,"ts_errors":0},"status":"keep","description":"Add useFaceRecognition hook tests: non-Error exceptions for recognize/register, empty result on error","timestamp":1778118538573,"segment":0,"confidence":13.490196078431373}
{"run":247,"commit":"bcbee73","metric":499,"metrics":{"api_tests":499,"frontend_tests":512,"ts_errors":0},"status":"keep","description":"Add faceEngineClient tests: custom URL, mimeType handling, default image/jpeg","timestamp":1778118723120,"segment":0,"confidence":13.346153846153847}
{"run":248,"commit":"34bc965","metric":501,"metrics":{"api_tests":501,"frontend_tests":512,"ts_errors":0},"status":"keep","description":"Add faceMatchEngine tests: null last_at fallback, empty query results","timestamp":1778118766518,"segment":0,"confidence":13.169811320754716}
{"t":"experiment","n":249,"commit":"54773404","metric":504,"status":"keep","description":"Add face recognition route tests: MULTIPLE_FACES, LOW_QUALITY, SERVICE_UNAVAILABLE errors during recognize","asi":{"hypothesis":"Add edge case tests for additional FaceEngineError codes during face recognition","api_tests":504,"frontend_tests":512,"ts_errors":0},"ts":"2026-05-06T01:56:00Z"}
{"t":"experiment","n":250,"commit":"54773404","metric":507,"status":"keep","description":"Add comprefaceClient tests: empty result/missing result fields, JSON response parsing","asi":{"hypothesis":"Add edge case tests for comprefaceClient recognize with empty/missing result fields and createSubject JSON parsing","api_tests":507,"frontend_tests":512,"ts_errors":0},"ts":"2026-05-06T02:00:00Z"}
{"t":"experiment","n":251,"commit":"146924ff","metric":507,"status":"keep","description":"Add faceRecognition API client tests: empty candidates, omitted source","asi":{"hypothesis":"Add edge case tests for empty candidates array and omitted source parameter in faceRecognition API client","api_tests":507,"frontend_tests":514,"ts_errors":0},"ts":"2026-05-06T02:03:00Z"}
{"t":"experiment","n":252,"commit":"8c55ebce","metric":509,"status":"keep","description":"Add faceEngineClient healthCheck tests: 500 status, empty data object","asi":{"hypothesis":"Add edge case tests for healthCheck with 500 status and empty data object","api_tests":509,"frontend_tests":514,"ts_errors":0},"ts":"2026-05-06T02:08:00Z"}
{"t":"experiment","n":253,"commit":"258134c0","metric":515,"status":"keep","description":"Add docker-compose validation tests: face-service healthcheck, restart policy, compreface services","asi":{"hypothesis":"Add more comprehensive docker-compose validation tests for face-service configuration","api_tests":515,"frontend_tests":514,"ts_errors":0},"ts":"2026-05-06T02:15:00Z"}
{"run":249,"commit":"0000000","metric":18,"metrics":{"api_tests":0,"ts_errors":18,"frontend_tests":0},"status":"crash","description":"TypeScript compilation failed - missing ExpandableText imports in several files","timestamp":1778146149863,"segment":0,"confidence":12.925925925925926,"asi":{"hypothesis":"Applied ExpandableText across codebase but missed imports in EmployeeTable, LinkedEmployees, Payment, PermissionBoard/EmployeeCard, ServiceCatalog. Also type mismatch in PermissionGroupConfig.","next_action_hint":"Add missing ExpandableText imports and fix type coercion for nullable description."}}
